{
  "$id": "https://niklasrosenstein.github.io/gitopsctr/schemas/apis/unit.gitopsctr.io/v1/Terraform/desired.schema.json",
  "$schema": "https://json-schema.org/draft/2020-12/schema",
  "additionalProperties": false,
  "properties": {
    "$schema": {
      "type": "string"
    },
    "apiVersion": {
      "const": "unit.gitopsctr.io/v1"
    },
    "kind": {
      "const": "Terraform"
    },
    "metadata": {
      "additionalProperties": false,
      "properties": {
        "name": {
          "minLength": 1,
          "type": "string"
        }
      },
      "required": [
        "name"
      ],
      "type": "object"
    },
    "spec": {
      "additionalProperties": false,
      "properties": {
        "inputs": {
          "anyOf": [
            {
              "propertyNames": {
                "type": "string"
              },
              "type": "object"
            },
            {
              "type": "null"
            }
          ],
          "default": null
        },
        "materialization": {
          "anyOf": [
            {
              "additionalProperties": false,
              "properties": {
                "$schema": {
                  "default": null
                },
                "digest": {
                  "type": "string"
                },
                "mediaType": {
                  "type": "string"
                },
                "metadata": {
                  "propertyNames": {
                    "type": "string"
                  },
                  "type": "object"
                },
                "path": {
                  "type": "string"
                }
              },
              "required": [
                "path",
                "mediaType",
                "digest",
                "metadata"
              ],
              "title": "MaterializationDocument",
              "type": "object"
            },
            {
              "type": "null"
            }
          ],
          "default": null
        },
        "resolvedInputs": {
          "anyOf": [
            {
              "additionalProperties": {
                "additionalProperties": {
                  "type": "string"
                },
                "propertyNames": {
                  "type": "string"
                },
                "type": "object"
              },
              "propertyNames": {
                "type": "string"
              },
              "type": "object"
            },
            {
              "type": "null"
            }
          ],
          "default": null
        },
        "source": {
          "additionalProperties": false,
          "properties": {
            "driverVersion": {
              "anyOf": [
                {
                  "type": "integer"
                },
                {
                  "type": "null"
                }
              ],
              "default": null
            },
            "inputHash": {
              "anyOf": [
                {
                  "type": "string"
                },
                {
                  "type": "null"
                }
              ],
              "default": null
            },
            "inputs": {
              "anyOf": [
                {
                  "items": {
                    "type": "string"
                  },
                  "type": "array"
                },
                {
                  "type": "null"
                }
              ],
              "default": null,
              "description": "Input paths or glob patterns resolved relative to source.path."
            },
            "path": {
              "description": "Repository-relative path resolved from the root of the selected source revision.",
              "type": "string"
            },
            "revision": {
              "anyOf": [
                {
                  "type": "string"
                },
                {
                  "type": "null"
                }
              ],
              "default": null
            }
          },
          "required": [
            "path"
          ],
          "title": "DesiredSource",
          "type": "object"
        },
        "terraform": {
          "anyOf": [
            {
              "additionalProperties": false,
              "properties": {
                "backend": {
                  "anyOf": [
                    {
                      "additionalProperties": {
                        "anyOf": [
                          {
                            "type": "string"
                          },
                          {
                            "type": "integer"
                          },
                          {
                            "type": "number"
                          },
                          {
                            "type": "boolean"
                          }
                        ]
                      },
                      "propertyNames": {
                        "type": "string"
                      },
                      "type": "object"
                    },
                    {
                      "type": "null"
                    }
                  ],
                  "default": null
                },
                "checks": {
                  "anyOf": [
                    {
                      "items": {
                        "additionalProperties": false,
                        "properties": {
                          "path": {
                            "default": "",
                            "type": "string"
                          },
                          "type": {
                            "const": "http"
                          },
                          "urlOutput": {
                            "type": "string"
                          }
                        },
                        "required": [
                          "type",
                          "urlOutput"
                        ],
                        "title": "TerraformHttpCheck",
                        "type": "object"
                      },
                      "type": "array"
                    },
                    {
                      "type": "null"
                    }
                  ],
                  "default": null
                },
                "observeOutputs": {
                  "anyOf": [
                    {
                      "items": {
                        "type": "string"
                      },
                      "type": "array"
                    },
                    {
                      "type": "null"
                    }
                  ],
                  "default": null
                },
                "variables": {
                  "anyOf": [
                    {
                      "propertyNames": {
                        "type": "string"
                      },
                      "type": "object"
                    },
                    {
                      "type": "null"
                    }
                  ],
                  "default": null
                }
              },
              "title": "TerraformConfiguration",
              "type": "object"
            },
            {
              "type": "null"
            }
          ],
          "default": null
        }
      },
      "required": [
        "source"
      ],
      "type": "object"
    }
  },
  "required": [
    "apiVersion",
    "kind",
    "metadata",
    "spec"
  ],
  "title": "Terraform (unit.gitopsctr.io/v1)",
  "type": "object"
}
