{
  "$schema": "https://niklasrosenstein.github.io/gitopsctr/schemas/apis/unit.gitopsctr.io/v1/Terraform/authored.schema.json",
  "apiVersion": "unit.gitopsctr.io/v1",
  "kind": "Terraform",
  "metadata": {
    "name": "aws-application"
  },
  "spec": {
    "source": {
      "path": "infrastructure"
    },
    "terraform": {
      "backend": {
        "key": "example/staging.tfstate"
      },
      "checks": [],
      "observeOutputs": [],
      "variables": {
        "environment": "staging"
      }
    }
  }
}
